Computer Architecture,Hennessy & Patterson: A New Golden Age for Computer Architecture,https://www.hpcwire.com/2018/04/17/hennessy-patterson-a-new-golden-age-for-computer-architecture/
Computer Architecture,A New Golden Age for Computer Architecture,https://cacm.acm.org/magazines/2019/2/234352-a-new-golden-age-for-computer-architecture/abstract
Computer Architecture,"NVIDIA : Mercedes-Benz, NVIDIA Announce Collaboration to Create New AI Computer Architecture for Mercedes Vehicles",https://www.marketscreener.com/NVIDIA-CORPORATION-10282/news/NVIDIA-Mercedes-Benz-NVIDIA-Announce-Collaboration-to-Create-New-AI-Computer-Architecture-for-Mer-27841094/
Computer Architecture,"Mercedes-Benz, NVIDIA Announce Collaboration to Create New AI Computer Architecture for Mercedes Vehicles",https://blogs.nvidia.com/blog/2019/01/08/mercedes-benz-nvidia-next-gen-vehicles/
Computer Architecture,"Computer Architecture Lab, National University of Singapore",https://academicjobsonline.org/ajo/NUS/Computer%2520Architecture%2520Lab/12336

Computer Vision,(USA) Computer Vision Engineer,https://dejobs.org/virtual-usa/computer-vision-engineer/F65DF09A43074673AE696E44C7726ABC/job/?vs=25
Computer Vision,allegro.ai and NetApp showcase integrated Solution for Deep Learning Computer Vision,http://gisuser.com/2019/03/allegro-ai-and-netapp-showcase-integrated-solution-for-deep-learning-computer-vision/
Computer Vision,) Data Analyst - Computer Vision,https://dejobs.org/new-york-ny/data-analyst-computer-vision/94036AC6BCDF4C979B7CBD75B802E2D0/job/?vs=25
Computer Vision,Computer Vision,https://machinelearningmastery.com/computer-vision-books/
Computer Vision,Entropix : to Explore Strategic Opportunities for Computer Vision Solutions in Collaboration with Lenovo™,https://www.marketscreener.com/news/Entropix-to-Explore-Strategic-Opportunities-for-Computer-Vision-Solutions-in-Collaboration-with-Le--28165739/

Network Architecture,) Customer Success Specialist-Digital Network Architecture - GES MidWest Atlantic,https://dejobs.org/chicago-il/customer-success-specialist-digital-network-architecture-ges-midwest-atlantic/A97B472FA35C49ABB42ADD45BC8A1CA2/job/?vs=25
Network Architecture,) Customer Success Specialist-Digital Network Architecture - GES West Coast,https://dejobs.org/san-jose-ca/customer-success-specialist-digital-network-architecture-ges-west-coast/F673B5ACE48141CBA8E6A3924DE0CD5B/job/?vs=25
Network Architecture,CHT completes 5G NSA network architecture,https://www.digitimes.com/news/a20190122PD201.html
Network Architecture,Datacentre Network Architecture Market Development Trend 2019 to 2025,http://www.sbwire.com/press-releases/datacentre-network-architecture-market-development-trend-2019-to-2025-1120064.htm
Network Architecture,Cisco Digital Network Architecture,https://www.expresscomputer.in/downloads/white-paper/cisco-digital-network-architecture/31505/

Avionics Engineering,) Military Avionics Engineering Product Lead,https://www.my.jobs/endicott-ny/military-avionics-engineering-product-lead/70539CE2B6A64AE0976801392B83C121/job/?vs=25


Wireless Engineering,) Wireless Engineering Specialist,https://www.my.jobs/cincinnati-oh/wireless-engineering-specialist/305CD41EB219492EA8A90C97D309584B/job/?vs=25
Wireless Engineering,) Technical Manager - Wireless Engineering,https://www.my.jobs/montreal-qc/technical-manager-wireless-engineering/6F699EEF53EF4503A0894D98101E9FCA/job/?vs=25
Wireless Engineering,Lead Engineer - Wireless Engineering,http://jobs.startribune.com/job/323117/lead-engineer-wireless-engineering/?TrackID=1

Design Automation,Global Electronic Design Automation Tools (EDA) Market Outlook to 2024 - ResearchAndMarkets.com,https://www.apnews.com/Business%2520Wire/3dd7fe7f4a674027998d59e10380c1e9
Design Automation,"Electronic Design Automation (EDA) Tools Market Emerging Trends and Company Profiles to Watch- Synopsys, Siemens PLM Software, Aldec, and Agnisys in 2017-2025",http://www.sbwire.com/press-releases/electronic-design-automation-eda-tools-market-emerging-trends-and-company-profiles-to-watch-synopsys-siemens-plm-software-aldec-and-agnisys-in-2017-2025-1168171.htm
Design Automation,The 11th Annual I LOVE DAC Campaign Kicks Off Registration for the 56th Design Automation Conference,https://www.marketscreener.com/news/The-11th-Annual-I-LOVE-DAC-Campaign-Kicks-Off-Registration-for-the-56th-Design-Automation-Conference--28146969/
Design Automation,"CAD Engineer - Front End Design Automation - Bengaluru (#1,37,22,08,569)",https://en-in.gigajob.com/job-offer-for-CAD-Engineer-Front-End-Design-Automation-Bengaluru-in-India-o1372208569
Design Automation,"Cloud Electronic Design Automation(Eda) Market Global Size, Share, Trend & Industry Analysis (2019-2026) by Top Players: Ansys, Aldec, Mentor Graphics, Synopsys, Sigrity",http://www.sbwire.com/press-releases/cloud-electronic-design-automationeda-market-global-size-share-trend-industry-analysis-2019-2026-by-top-players-ansys-aldec-mentor-graphics-synopsys-sigrity-1162489.htm


Embedded Systems,"Sr Engineer II, SW : Embedded systems, Linux, Android : Hypervisor. (#1,38,68,19,432)",https://en-in.gigajob.com/job-offer-for-Sr-Engineer-Embedded-systems-Linux-Android-Hypervisor-in-Bangalore-o1386819432
Embedded Systems,"Global Automotive Embedded Systems Market Key Players, Competitive Bench-marking, Company Market Shares & Forecast By 2028",https://chollywood.info/global-automotive-embedded-systems-market-key-players-competitive-bench-marking-company-market-shares-forecast-by-2028/
Embedded Systems,) Embedded Systems Requirements Engineer - 2019,https://dejobs.org/saginaw-mi/embedded-systems-requirements-engineer-2019/024BC60FF2034D64BF6326169E3A27B0/job/?vs=25
Embedded Systems,"Smartphone-based Automotive Infotainment Systems Market Outlook to 2025 – Apple, Car Connectivity Consortium, Ford Motor Company, Abalta Technologies, AllGo Embedded Systems, Alphabet",https://empowerednews.net/smartphone-based-automotive-infotainment-systems-market-outlook-to-2025-apple-car-connectivity-consortium-ford-motor-company-abalta-technologies-allgo-embedded-systems-alphabet/181484337/
Embedded Systems,) Embedded Systems Development Intern - High School Student,https://dejobs.org/goleta-ca/embedded-systems-development-intern-high-school-student/16346371421D4330AAB1BB371CC41323/job/?vs=25

VLSI,"Vlsi System Design Or Qualty Engineering 1Year Experiance (#1,38,30,03,394)",https://en-in.gigajob.com/job-offer-for-Vlsi-System-Design-Qualty-Engineering-1Year-Experiance-in-India-o1383003394
VLSI,"VLSI Engineer - Verification (#1,37,04,86,356)",https://en-in.gigajob.com/job-offer-for-VLSI-Engineer-Verification-in-Bangalore-o1370486356
VLSI,"VLSI Engineer - Verification (#1,36,70,98,893)",https://en-in.gigajob.com/job-offer-for-VLSI-Engineer-Verification-in-Kochi-o1367098893
VLSI,"Princ Eng Design Engn (VLSI Layout Engineer) (#1,36,13,37,088)",https://en-in.gigajob.com/job-offer-for-Princ-Eng-Design-Engn-VLSI-Layout-Engineer-in-India-o1361337088
VLSI,"Architect - C++/Image Processing (5-10 yrs) Bangalore (Semiconductor/VLSI/EDA) (#1,34,71,04,922)",https://en-in.gigajob.com/job-offer-for-Architect-C%2B%2B-Image-Processing-5-10-yrs-Bangalore-Semiconductor-VLSI-EDA-in-Bangalore-o1347104922

Control Systems,OETC launches new control systems projects in Oman,http://www.technicalreviewmiddleeast.com/power-a-water/transmission/oetc-launches-new-control-systems-projects-in-oman
Control Systems,OETC launches new control systems projects in Oman,http://technicalreviewmiddleeast.com/power-a-water/transmission/oetc-launches-new-control-systems-projects-in-oman
Control Systems,Greenhouse Environment Control Systems Market Report Status and Outlook 2019-2025,http://www.sbwire.com/press-releases/greenhouse-environment-control-systems-market-report-status-and-outlook-2019-2025-1173069.htm
Control Systems,"Version Control Systems Market Leading Key Players Git, Mercurial, Canonical Ltd., WANdisco, IBM, Microsoft Corporation, Apache Software Foundation, Perforce",http://www.sbwire.com/press-releases/version-control-systems-market-leading-key-players-git-mercurial-canonical-ltd-wandisco-ibm-microsoft-corporation-apache-software-foundation-perforce-1172460.htm
Control Systems,"IDEAL INDUSTRIES, INC. Acquires Cree Commercial Lighting and Intelligent Lighting Control Systems",https://www.marketscreener.com/news/IDEAL-INDUSTRIES-INC-Acquires-Cree-Commercial-Lighting-and-Intelligent-Lighting-Control-Systems--28173360/

Signal Processing,Digital signal processing in FPGA for particle track reconstruction at the HL-LHC ATLAS,http://cds.cern.ch/record/2666977
Signal Processing,APEX Announces New Token Based Licensing Model for Offline Signal Processing Software,https://www.benzinga.com/pressreleases/19/03/r13348388/apex-announces-new-token-based-licensing-model-for-offline-signal-proc
Signal Processing,APEX Announces New Token Based Licensing Model for Offline Signal Processing Software,https://www.finanzen.ch/nachrichten/aktien/apex-announces-new-token-based-licensing-model-for-offline-signal-processing-software-1028025055
Signal Processing,APEX Announces New Token Based Licensing Model for Offline Signal Processing Software,http://www.digitaljournal.com/pr/4203913
Signal Processing,"Digital Signal Processing/ DSP Technology Specialist Ahmedabad (#1,37,22,08,612)",https://en-in.gigajob.com/job-offer-for-Digital-Signal-Processing-DSP-Technology-Specialist-Ahmedabad-in-Ahmedabad-o1372208612

Robotics,Reviewing Restoration Robotics (HAIR) & Repro-Med Systems (REPR),https://www.dispatchtribunal.com/2019/03/17/reviewing-restoration-robotics-hair-repro-med-systems-repr.html
Robotics,LET&#39;S TALK: Robotics for seniors a&#39;coming,https://www.nwaonline.com/news/2019/mar/17/robotics-for-seniors-a-coming-20190317/
Robotics,LET&#39;S TALK: Robotics for seniors a&#39;coming,https://www.arkansasonline.com/news/2019/mar/17/robotics-for-seniors-a-coming-20190317/
Robotics,Top local robot makers show their stuff at FIRST Robotics,https://www.whec.com/news/top-local-robot-makers-show-their-stuff-at-first-robotics/5281859/?cat=565
Robotics,"School,Mohali Requires.Tgt-Social Studies,Tgt-English,Robotics Traine (#1,38,88,60,580)",https://en-in.gigajob.com/job-offer-for-School-Mohali-Requires-Tgt-Social-Studies-Tgt-English-Robotics-Traine-in-Chandigarh-o1388860580

Nano-Technology,Luxury Folding Carton Market: Nano-Technology Decorative Elements in Luxury Folding Cartons to Capture Consumer Attention: Watch out 2027,http://www.sbwire.com/press-releases/luxury-folding-carton-market-nano-technology-decorative-elements-in-luxury-folding-cartons-to-capture-consumer-attention-watch-out-2027-1173080.htm
Nano-Technology,"Nanographic Printing Is Expected to Grow on the Backdrop of Markets Using Nano Technology in 2019 and Majorly Offered by Landa Corp., Based in Israel",http://www.sbwire.com/press-releases/nanographic-printing-is-expected-to-grow-on-the-backdrop-of-markets-using-nano-technology-in-2019-and-majorly-offered-by-landa-corp-based-in-israel-1144116.htm
Nano-Technology,Nano technology offers hope for better cancer testing,https://indianewengland.com/2018/11/nano-technology-offers-hope-for-better-cancer-testing/
Nano-Technology,New nano technology offers hope for better cancer testing: Study,https://www.thehealthsite.com/news/new-nano-technology-offers-hope-for-better-cancer-testing-study/
Nano-Technology,Nano technology offers hope for better cancer testing,https://www.socialnews.xyz/2018/11/28/nano-technology-offers-hope-for-better-cancer-testing/


Mechatronics,System Engineer Mechatronics Leuven,http://netherlands.jobrat.net/2019/03/07/system-engineer-mechatronics-leuven-2/
Mechatronics,) Mechatronics Engineer,https://dejobs.org/colico-ita/mechatronics-engineer/A0461AD58B5E44E9A671721EC25C7704/job/?vs=25
Mechatronics,Cambridge Mechatronics : technologies integrated into Qualcomm's chips with TDK smartphone camera software controller,https://www.marketscreener.com/news/Cambridge-Mechatronics-technologies-integrated-into-Qualcomm-s-chips-with-TDK-smartphone-camera-so--28074052/
Mechatronics,"Linear Slides Market 2025: Top Key Players Holmarc Opto-Mechatronics (P) Ltd., Reliance Precision Ltd.",http://www.sbwire.com/press-releases/linear-slides-market-2025-top-key-players-holmarc-opto-mechatronics-p-ltd-reliance-precision-ltd-1157801.htm
Mechatronics,"Mechatronics and Robotics Courses Market Analysis, Share and Size, Trends, Industry Growth And Segment Forecasts To 2023",https://www.pressebox.de/inaktiv/market-research-future/Mechatronics-and-Robotics-Courses-Market-Analysis-Share-and-Size-Trends-Industry-Growth-And-Segment-Forecasts-To-2023/boxid/943041

Image Processing,Dornier MedTech Announces Dornier OptiVision Next-Generation Digital Image Processing Technology for Stone Treatment and Day-to-Day Endourology,https://www.finanznachrichten.de/nachrichten-2019-03/46212296-dornier-medtech-announces-dornier-optivision-next-generation-digital-image-processing-technology-for-stone-treatment-and-day-to-day-endourology-008.htm
Image Processing,"DE Jobs - The MITRE Corporation Lead/Senior C Developer / Computational Image Processing Expert - 00052695 in McLean, Virginia, United States",https://dejobs.org/mclean-va/leadsenior-c-developer-computational-image-processing-expert-00052695/8D66C16064324E389EC836F65F18F4C9/job/?vs=25
Image Processing,Image Processing Engineer - Machine Learning/Algorithm (3-8 yrs) Mumbai...,https://en-in.gigajob.com/job-offer-for-Image-Processing-Engineer-Machine-Learning-Algorithm-3-8-yrs-Mumbai-Systems-Product-Software-in-Mumbai-o1347104780
Image Processing,Medical Image Processing Engineer - DSP/MATLAB/OpenCV (5-8 yrs) Bangalore...,https://en-in.gigajob.com/job-offer-for-Medical-Image-Processing-Engineer-DSP-MATLAB-OpenCV-5-8-yrs-Bangalore-Systems-Product-Software-in-Bangalore-o1347104869
Image Processing,"Architect - C++/Image Processing (5-10 yrs) Bangalore (Semiconductor/VLSI/EDA) (#1,34,71,04,922)",https://en-in.gigajob.com/job-offer-for-Architect-C%2B%2B-Image-Processing-5-10-yrs-Bangalore-Semiconductor-VLSI-EDA-in-Bangalore-o1347104922

Power Electronics/Systems,"NASA’s IMAGE Satellite Still Has Functional Power, Electronics Systems",https://www.extremetech.com/extreme/263459-nasa-reports-image-satellite-still-functional-power-electronics-systems

Digital Systems,Digital Systems That Let Visitors In At Risk Of Being Hacked,https://www.pymnts.com/news/security-and-risk/2019/ibm-digital-systems-office-buildings-hackers/
Digital Systems,Scholarly Publishing- Digital Systems Manager,https://www.mediabistro.com/jobs/description/390853/scholarly-publishing-digital-systems-manager/
Digital Systems,) Sr. Digital Systems Specialist,https://dejobs.org/mossville-il/sr-digital-systems-specialist/EE51CAD120324BCB9DFE0255457E414B/job/?vs=25
Digital Systems,"Global Hologram Projector Market 2019: HEREHOLOCUBE, Christie Digital Systems, Panasonic, 360BrandVision",http://www.beinternetnews.com/global-hologram-projector-market-2019-hereholocube-christie-digital-systems-panasonic-360brandvision-2/
