Financial Engineering,"Where Will Be Financial Engineering Market in 5 Years? by Demanding Key Players Like Moody's Corporation, Morgan McKinley, Kingfisher Plc",http://www.sbwire.com/press-releases/where-will-be-financial-engineering-market-in-5-years-by-demanding-key-players-like-moodys-corporation-morgan-mckinley-kingfisher-plc-1171501.htm
Financial Engineering,"“Software Engineering in Bitcoin Beats Financial Engineering And Will Continue To Do So For Times To Come”, Claims Anthony Pompliano – BlockPublisher",http://softwareguru.biz/software-engineering-in-bitcoin-beats-financial-engineering-and-will-continue-to-do-so-for-times-to-come-claims-anthony-pompliano-blockpublisher/
Financial Engineering,Apple's world-beating financial engineering is teaching the corporate world how to exploit Trump's tax cuts,https://boingboing.net/2018/11/14/looter-friendly-policies.html
Financial Engineering,The Dangers of U.S. Style Financial Engineering,https://www.theglobalist.com/financial-engineering-stock-market-capitalism/
Financial Engineering,RTFX and RTFT. A successful partnership centred around investment expertise and innovative financial engineering,https://www.e-forex.net/articles/jul-2014-rtfx-and-rtft-a-successful-partnership-centred-around-investment-expertise-and-innovative-financial-engineering.html

Financial Risk Management,"Financial Risk Management Software Market by Top Key Players: IBM, Oracle, SAP, SAS, Experian, Misys, Fiserv, Kyriba, Active Risk, Pegasystems, TFG Systems",http://www.sbwire.com/press-releases/financial-risk-management-software-market-by-top-key-players-ibm-oracle-sap-sas-experian-misys-fiserv-kyriba-active-risk-pegasystems-tfg-systems-1167231.htm
Financial Risk Management,Schwab US Broad Market ETF (SCHB) Shares Sold by Milliman Financial Risk Management LLC,https://www.dispatchtribunal.com/2019/03/05/schwab-us-broad-market-etf-schb-shares-sold-by-milliman-financial-risk-management-llc.html
Financial Risk Management,Milliman Financial Risk Management LLC Reduces Holdings in Schwab US Broad Market ETF (SCHB),https://theenterpriseleader.com/2019/03/05/milliman-financial-risk-management-llc-reduces-holdings-in-schwab-us-broad-market-etf-schb.html
Financial Risk Management,Global Financial Risk Management Consulting Market 2019 Enhanced Growth & Opportunity,http://www.sbwire.com/press-releases/global-financial-risk-management-consulting-market-2019-enhanced-growth-opportunity-by-demanding-players-accenture-deloitte-ibm-kpmg-pwc-arcadis-1152334.htm
Financial Risk Management,"Financial Risk Management Market Growing Dynamically with IBM, Oracle, SAP, SAS, Experian, Misys, Pegasystems, TFG Systems, Zoot Origination, Riskdata",http://www.sbwire.com/press-releases/financial-risk-management-market-growing-dynamically-with-ibm-oracle-sap-sas-experian-misys-pegasystems-tfg-systems-zoot-origination-riskdata-1145224.htm

Computational Finance,"Quantitative Methods in Derivatives Pricing. An Introduction to Computational Finance. Wiley Finance – Business and Finance, Capital Markets, Derivatives, Finance Industries",http://www.military-technologies.net/2018/02/07/quantitative-methods-in-derivatives-pricing-an-introduction-to-computational-finance-wiley-finance-business-and-finance-capital-markets-derivatives-finance-industries/
Computational Finance,"Quantitative Methods in Derivatives Pricing. An Introduction to Computational Finance. Wiley Finance – Business and Finance, Capital Markets, Derivatives, Finance Industries",http://www.satprnews.com/2018/02/07/quantitative-methods-in-derivatives-pricing-an-introduction-to-computational-finance-wiley-finance-business-and-finance-capital-markets-derivatives-finance-industries/


